{
  "schema_version": 1,
  "evidence_id": "example-evidence",
  "kind": "test",
  "workspace_root": "/absolute/path/to/workspace",
  "subject_fingerprints": {
    "relative/file/under/workspace.py": "sha256-of-file-content-or-null-if-absent"
  },
  "execution": {
    "argv": ["python3", "-m", "unittest", "discover", "-s", "tests"],
    "cwd": "/absolute/path/to/workspace",
    "exit_code": 0,
    "signal": null,
    "start_error": null
  },
  "host_context": null,
  "capture": {
    "origin": "tool_output",
    "relative_path": "evidence/example-evidence.out",
    "content_sha256": "sha256-of-the-raw-capture-file"
  },
  "result": "pass",
  "observations": ["What was actually observed, kept short"],
  "started_at": "2026-01-01T00:00:00Z",
  "finished_at": "2026-01-01T00:00:01Z"
}
